{
  "schema_family": "normalized-result",
  "schema_version": "v0",
  "adapter_family": "security-scan",
  "adapter_name": "trivy",
  "normalized_at": "2026-03-21T10:20:00Z",
  "source_execution_refs": [
    {
      "kind": "raw-result",
      "ref": "exec-20260321-0001"
    }
  ],
  "issues": [
    {
      "id": "CVE-2025-12345",
      "category": "vulnerability",
      "severity": "high",
      "summary": "openssl vulnerable package detected",
      "location": "image layer /usr/lib/libssl.so",
      "evidence_refs": [
        {
          "kind": "artifact-path",
          "ref": "artifacts/raw/trivy/stdout.json"
        }
      ]
    }
  ],
  "metrics": [
    {
      "name": "scan_duration_ms",
      "kind": "integer",
      "unit": "ms",
      "value": 8000
    },
    {
      "name": "issues_found",
      "kind": "integer",
      "unit": "count",
      "value": 1
    },
    {
      "name": "evidence_sources_present",
      "kind": "boolean",
      "value": true
    }
  ],
  "severity_rollup": {
    "critical": 0,
    "high": 1,
    "medium": 0,
    "low": 0,
    "info": 0,
    "unknown": 0,
    "total": 1
  },
  "evidence_completeness": {
    "status": "complete",
    "policy_ready": true,
    "notes": "Normalized evidence includes issue, severity rollup, and raw evidence linkage."
  }
}